{
 "schemaVersion": 1,
 "type": "standings",
 "id": "baseball.npb:2025",
 "updatedAt": "2026-10-03T18:08:24Z",
 "sources": [
  "npb"
 ],
 "competitionId": "baseball.npb",
 "season": "2025",
 "groups": [
  {
   "id": "central",
   "name": "Liga Central",
   "rows": [
    {
     "participantId": "baseball.hanshin-tigers",
     "participantType": "team",
     "rank": 1,
     "stats": {
      "GP": 143,
      "W": 85,
      "L": 54,
      "T": 4,
      "PCT": 0.612,
      "HOME": "41-29",
      "AWAY": "44-25"
     }
    },
    {
     "participantId": "baseball.yokohama-dena-baystars",
     "participantType": "team",
     "rank": 2,
     "stats": {
      "GP": 143,
      "W": 71,
      "L": 66,
      "T": 6,
      "PCT": 0.518,
      "GB": 13.0,
      "HOME": "36-32",
      "AWAY": "35-34"
     }
    },
    {
     "participantId": "baseball.yomiuri-giants",
     "participantType": "team",
     "rank": 3,
     "stats": {
      "GP": 143,
      "W": 70,
      "L": 69,
      "T": 4,
      "PCT": 0.504,
      "GB": 15.0,
      "HOME": "44-26",
      "AWAY": "26-43"
     }
    },
    {
     "participantId": "baseball.chunichi-dragons",
     "participantType": "team",
     "rank": 4,
     "stats": {
      "GP": 143,
      "W": 63,
      "L": 78,
      "T": 2,
      "PCT": 0.447,
      "GB": 23.0,
      "HOME": "35-36",
      "AWAY": "28-42"
     }
    },
    {
     "participantId": "baseball.hiroshima-toyo-carp",
     "participantType": "team",
     "rank": 5,
     "stats": {
      "GP": 143,
      "W": 59,
      "L": 79,
      "T": 5,
      "PCT": 0.428,
      "GB": 25.5,
      "HOME": "37-32",
      "AWAY": "22-47"
     }
    },
    {
     "participantId": "baseball.tokyo-yakult-swallows",
     "participantType": "team",
     "rank": 6,
     "stats": {
      "GP": 143,
      "W": 57,
      "L": 79,
      "T": 7,
      "PCT": 0.419,
      "GB": 26.5,
      "HOME": "32-35",
      "AWAY": "25-44"
     }
    }
   ]
  },
  {
   "id": "pacific",
   "name": "Liga del Pacífico",
   "rows": [
    {
     "participantId": "baseball.fukuoka-softbank-hawks",
     "participantType": "team",
     "rank": 1,
     "stats": {
      "GP": 143,
      "W": 87,
      "L": 52,
      "T": 4,
      "PCT": 0.626,
      "HOME": "44-24",
      "AWAY": "43-28"
     }
    },
    {
     "participantId": "baseball.hokkaido-nippon-ham-fighters",
     "participantType": "team",
     "rank": 2,
     "stats": {
      "GP": 143,
      "W": 83,
      "L": 57,
      "T": 3,
      "PCT": 0.593,
      "GB": 4.5,
      "HOME": "43-28",
      "AWAY": "40-29"
     }
    },
    {
     "participantId": "baseball.orix-buffaloes",
     "participantType": "team",
     "rank": 3,
     "stats": {
      "GP": 143,
      "W": 74,
      "L": 66,
      "T": 3,
      "PCT": 0.529,
      "GB": 13.5,
      "HOME": "38-32",
      "AWAY": "36-34"
     }
    },
    {
     "participantId": "baseball.tohoku-rakuten-golden-eagles",
     "participantType": "team",
     "rank": 4,
     "stats": {
      "GP": 143,
      "W": 67,
      "L": 74,
      "T": 2,
      "PCT": 0.475,
      "GB": 21.0,
      "HOME": "35-36",
      "AWAY": "32-38"
     }
    },
    {
     "participantId": "baseball.saitama-seibu-lions",
     "participantType": "team",
     "rank": 5,
     "stats": {
      "GP": 143,
      "W": 63,
      "L": 77,
      "T": 3,
      "PCT": 0.45,
      "GB": 24.5,
      "HOME": "35-34",
      "AWAY": "28-43"
     }
    },
    {
     "participantId": "baseball.chiba-lotte-marines",
     "participantType": "team",
     "rank": 6,
     "stats": {
      "GP": 143,
      "W": 56,
      "L": 84,
      "T": 3,
      "PCT": 0.4,
      "GB": 31.5,
      "HOME": "33-38",
      "AWAY": "23-46"
     }
    }
   ]
  }
 ]
}
