{
 "schemaVersion": 1,
 "type": "standings",
 "id": "soccer.bra-1:2026",
 "updatedAt": "2026-10-31T05:44:55Z",
 "sources": [
  "espn"
 ],
 "competitionId": "soccer.bra-1",
 "season": "2026",
 "groups": [
  {
   "id": "1",
   "name": "2026",
   "rows": [
    {
     "participantId": "soccer.flamengo",
     "participantType": "team",
     "rank": 1,
     "stats": {
      "GP": 33,
      "W": 22,
      "D": 7,
      "L": 4,
      "GF": 68,
      "GA": 28,
      "GD": 40,
      "PTS": 73
     }
    },
    {
     "participantId": "soccer.palmeiras",
     "participantType": "team",
     "rank": 2,
     "stats": {
      "GP": 33,
      "W": 20,
      "D": 10,
      "L": 3,
      "GF": 56,
      "GA": 22,
      "GD": 34,
      "PTS": 70
     }
    },
    {
     "participantId": "soccer.cruzeiro",
     "participantType": "team",
     "rank": 3,
     "stats": {
      "GP": 33,
      "W": 17,
      "D": 6,
      "L": 10,
      "GF": 52,
      "GA": 46,
      "GD": 6,
      "PTS": 57
     }
    },
    {
     "participantId": "soccer.fluminense",
     "participantType": "team",
     "rank": 4,
     "stats": {
      "GP": 33,
      "W": 15,
      "D": 9,
      "L": 9,
      "GF": 52,
      "GA": 42,
      "GD": 10,
      "PTS": 54
     }
    },
    {
     "participantId": "soccer.athletico-paranaense",
     "participantType": "team",
     "rank": 5,
     "stats": {
      "GP": 33,
      "W": 15,
      "D": 9,
      "L": 9,
      "GF": 50,
      "GA": 40,
      "GD": 10,
      "PTS": 54
     }
    },
    {
     "participantId": "soccer.bahia",
     "participantType": "team",
     "rank": 6,
     "stats": {
      "GP": 33,
      "W": 14,
      "D": 11,
      "L": 8,
      "GF": 48,
      "GA": 42,
      "GD": 6,
      "PTS": 53
     }
    },
    {
     "participantId": "soccer.atletico-mg",
     "participantType": "team",
     "rank": 7,
     "stats": {
      "GP": 33,
      "W": 14,
      "D": 8,
      "L": 11,
      "GF": 44,
      "GA": 39,
      "GD": 5,
      "PTS": 50
     }
    },
    {
     "participantId": "soccer.santos-2",
     "participantType": "team",
     "rank": 8,
     "stats": {
      "GP": 33,
      "W": 12,
      "D": 11,
      "L": 10,
      "GF": 49,
      "GA": 47,
      "GD": 2,
      "PTS": 47
     }
    },
    {
     "participantId": "soccer.red-bull-bragantino",
     "participantType": "team",
     "rank": 9,
     "stats": {
      "GP": 33,
      "W": 12,
      "D": 8,
      "L": 13,
      "GF": 42,
      "GA": 38,
      "GD": 4,
      "PTS": 44
     }
    },
    {
     "participantId": "soccer.sao-paulo",
     "participantType": "team",
     "rank": 10,
     "stats": {
      "GP": 33,
      "W": 12,
      "D": 7,
      "L": 14,
      "GF": 39,
      "GA": 39,
      "GD": 0,
      "PTS": 43
     }
    },
    {
     "participantId": "soccer.botafogo",
     "participantType": "team",
     "rank": 11,
     "stats": {
      "GP": 33,
      "W": 10,
      "D": 9,
      "L": 14,
      "GF": 45,
      "GA": 53,
      "GD": -8,
      "PTS": 39
     }
    },
    {
     "participantId": "soccer.coritiba",
     "participantType": "team",
     "rank": 12,
     "stats": {
      "GP": 32,
      "W": 10,
      "D": 9,
      "L": 13,
      "GF": 38,
      "GA": 50,
      "GD": -12,
      "PTS": 39
     }
    },
    {
     "participantId": "soccer.vasco-da-gama",
     "participantType": "team",
     "rank": 13,
     "stats": {
      "GP": 32,
      "W": 10,
      "D": 8,
      "L": 14,
      "GF": 40,
      "GA": 49,
      "GD": -9,
      "PTS": 38
     }
    },
    {
     "participantId": "soccer.vitoria",
     "participantType": "team",
     "rank": 14,
     "stats": {
      "GP": 32,
      "W": 10,
      "D": 8,
      "L": 14,
      "GF": 35,
      "GA": 46,
      "GD": -11,
      "PTS": 38
     }
    },
    {
     "participantId": "soccer.gremio",
     "participantType": "team",
     "rank": 15,
     "stats": {
      "GP": 33,
      "W": 9,
      "D": 10,
      "L": 14,
      "GF": 37,
      "GA": 44,
      "GD": -7,
      "PTS": 37
     }
    },
    {
     "participantId": "soccer.mirassol",
     "participantType": "team",
     "rank": 16,
     "stats": {
      "GP": 33,
      "W": 9,
      "D": 10,
      "L": 14,
      "GF": 37,
      "GA": 47,
      "GD": -10,
      "PTS": 37
     }
    },
    {
     "participantId": "soccer.corinthians",
     "participantType": "team",
     "rank": 17,
     "stats": {
      "GP": 33,
      "W": 9,
      "D": 9,
      "L": 15,
      "GF": 36,
      "GA": 42,
      "GD": -6,
      "PTS": 36
     }
    },
    {
     "participantId": "soccer.internacional",
     "participantType": "team",
     "rank": 18,
     "stats": {
      "GP": 33,
      "W": 8,
      "D": 11,
      "L": 14,
      "GF": 37,
      "GA": 42,
      "GD": -5,
      "PTS": 35
     }
    },
    {
     "participantId": "soccer.remo",
     "participantType": "team",
     "rank": 19,
     "stats": {
      "GP": 33,
      "W": 6,
      "D": 11,
      "L": 16,
      "GF": 36,
      "GA": 51,
      "GD": -15,
      "PTS": 29
     }
    },
    {
     "participantId": "soccer.chapecoense",
     "participantType": "team",
     "rank": 20,
     "stats": {
      "GP": 32,
      "W": 4,
      "D": 9,
      "L": 19,
      "GF": 32,
      "GA": 66,
      "GD": -34,
      "PTS": 21
     }
    }
   ]
  }
 ]
}
