{
 "schemaVersion": 1,
 "type": "standings",
 "id": "baseball.lvbp:2025-26",
 "updatedAt": "2026-10-03T18:04:32Z",
 "sources": [
  "mlb-statsapi"
 ],
 "competitionId": "baseball.lvbp",
 "season": "2025-26",
 "groups": [
  {
   "id": "135",
   "name": "Liga Venezolana de Béisbol Profesional (LVBP)",
   "rows": [
    {
     "participantId": "baseball.cardenales-de-lara",
     "participantType": "team",
     "rank": 1,
     "stats": {
      "GP": 56,
      "W": 30,
      "L": 26,
      "PCT": 0.536,
      "STRK": "L1",
      "L10": "6-4",
      "HOME": "16-12",
      "AWAY": "14-14",
      "RS": 352,
      "RA": 307,
      "RD": 45
     },
     "extra": {
      "clinchIndicator": "@",
      "leagueRank": "1"
     }
    },
    {
     "participantId": "baseball.bravos-de-margarita",
     "participantType": "team",
     "rank": 2,
     "stats": {
      "GP": 56,
      "W": 29,
      "L": 27,
      "PCT": 0.518,
      "STRK": "L6",
      "L10": "3-7",
      "HOME": "16-12",
      "AWAY": "13-15",
      "RS": 308,
      "RA": 295,
      "RD": 13
     },
     "extra": {
      "clinchIndicator": "@",
      "leagueRank": "2"
     }
    },
    {
     "participantId": "baseball.navegantes-del-magallanes",
     "participantType": "team",
     "rank": 3,
     "stats": {
      "GP": 56,
      "W": 29,
      "L": 27,
      "PCT": 0.518,
      "STRK": "W3",
      "L10": "7-3",
      "HOME": "18-10",
      "AWAY": "11-17",
      "RS": 309,
      "RA": 277,
      "RD": 32
     },
     "extra": {
      "clinchIndicator": "@",
      "leagueRank": "3"
     }
    },
    {
     "participantId": "baseball.aguilas-del-zulia",
     "participantType": "team",
     "rank": 4,
     "stats": {
      "GP": 56,
      "W": 29,
      "L": 27,
      "PCT": 0.518,
      "STRK": "W1",
      "L10": "6-4",
      "HOME": "16-12",
      "AWAY": "13-15",
      "RS": 261,
      "RA": 337,
      "RD": -76
     },
     "extra": {
      "clinchIndicator": "@",
      "leagueRank": "4"
     }
    },
    {
     "participantId": "baseball.caribes-de-anzoategui",
     "participantType": "team",
     "rank": 5,
     "stats": {
      "GP": 56,
      "W": 28,
      "L": 28,
      "PCT": 0.5,
      "STRK": "L1",
      "L10": "4-6",
      "HOME": "18-10",
      "AWAY": "10-18",
      "RS": 349,
      "RA": 326,
      "RD": 23
     },
     "extra": {
      "clinchIndicator": "@",
      "leagueRank": "5"
     }
    },
    {
     "participantId": "baseball.tigres-de-aragua",
     "participantType": "team",
     "rank": 6,
     "stats": {
      "GP": 56,
      "W": 28,
      "L": 28,
      "PCT": 0.5,
      "STRK": "W3",
      "L10": "4-6",
      "HOME": "19-9",
      "AWAY": "9-19",
      "RS": 282,
      "RA": 280,
      "RD": 2
     },
     "extra": {
      "clinchIndicator": "&",
      "leagueRank": "6"
     }
    },
    {
     "participantId": "baseball.tiburones-de-la-guaira",
     "participantType": "team",
     "rank": 7,
     "stats": {
      "GP": 56,
      "W": 27,
      "L": 29,
      "PCT": 0.482,
      "STRK": "W1",
      "L10": "5-5",
      "HOME": "14-14",
      "AWAY": "13-15",
      "RS": 318,
      "RA": 320,
      "RD": -2
     },
     "extra": {
      "leagueRank": "7"
     }
    },
    {
     "participantId": "baseball.leones-del-caracas",
     "participantType": "team",
     "rank": 8,
     "stats": {
      "GP": 56,
      "W": 24,
      "L": 32,
      "PCT": 0.429,
      "STRK": "L2",
      "L10": "3-7",
      "HOME": "14-14",
      "AWAY": "10-18",
      "RS": 319,
      "RA": 356,
      "RD": -37
     },
     "extra": {
      "leagueRank": "8"
     }
    }
   ]
  }
 ]
}
