{
 "schemaVersion": 1,
 "type": "standings",
 "id": "soccer.tur-1:2026-27",
 "updatedAt": "2026-10-25T16:20:17Z",
 "sources": [
  "espn"
 ],
 "competitionId": "soccer.tur-1",
 "season": "2026-27",
 "groups": [
  {
   "id": "1",
   "name": "2026/2027 Turkish Super Lig",
   "rows": [
    {
     "participantId": "soccer.amed-sfk",
     "participantType": "team",
     "rank": 1,
     "stats": {
      "GP": 9,
      "W": 6,
      "D": 2,
      "L": 1,
      "GF": 20,
      "GA": 10,
      "GD": 10,
      "PTS": 20
     },
     "extra": {
      "note": {
       "text": "Champions League",
       "color": "#81D6AC"
      }
     }
    },
    {
     "participantId": "soccer.galatasaray",
     "participantType": "team",
     "rank": 2,
     "stats": {
      "GP": 8,
      "W": 6,
      "D": 1,
      "L": 1,
      "GF": 17,
      "GA": 11,
      "GD": 6,
      "PTS": 19
     },
     "extra": {
      "note": {
       "text": "Champions League qualifying",
       "color": "#B5E7CE"
      }
     }
    },
    {
     "participantId": "soccer.fenerbahce",
     "participantType": "team",
     "rank": 3,
     "stats": {
      "GP": 8,
      "W": 5,
      "D": 1,
      "L": 2,
      "GF": 22,
      "GA": 6,
      "GD": 16,
      "PTS": 16
     },
     "extra": {
      "note": {
       "text": "Europa League qualifying",
       "color": "#B2BFD0"
      }
     }
    },
    {
     "participantId": "soccer.trabzonspor",
     "participantType": "team",
     "rank": 4,
     "stats": {
      "GP": 8,
      "W": 5,
      "D": 1,
      "L": 2,
      "GF": 18,
      "GA": 5,
      "GD": 13,
      "PTS": 16
     },
     "extra": {
      "note": {
       "text": "Conference League qualifying",
       "color": "#c6d1e0"
      }
     }
    },
    {
     "participantId": "soccer.kasimpasa",
     "participantType": "team",
     "rank": 5,
     "stats": {
      "GP": 9,
      "W": 4,
      "D": 4,
      "L": 1,
      "GF": 13,
      "GA": 9,
      "GD": 4,
      "PTS": 16
     }
    },
    {
     "participantId": "soccer.besiktas",
     "participantType": "team",
     "rank": 6,
     "stats": {
      "GP": 8,
      "W": 5,
      "D": 0,
      "L": 3,
      "GF": 16,
      "GA": 10,
      "GD": 6,
      "PTS": 15
     }
    },
    {
     "participantId": "soccer.kocaelispor",
     "participantType": "team",
     "rank": 7,
     "stats": {
      "GP": 9,
      "W": 5,
      "D": 0,
      "L": 4,
      "GF": 11,
      "GA": 9,
      "GD": 2,
      "PTS": 15
     }
    },
    {
     "participantId": "soccer.erzurum-bb",
     "participantType": "team",
     "rank": 8,
     "stats": {
      "GP": 9,
      "W": 4,
      "D": 2,
      "L": 3,
      "GF": 8,
      "GA": 12,
      "GD": -4,
      "PTS": 14
     }
    },
    {
     "participantId": "soccer.corum-fk",
     "participantType": "team",
     "rank": 9,
     "stats": {
      "GP": 8,
      "W": 4,
      "D": 1,
      "L": 3,
      "GF": 18,
      "GA": 13,
      "GD": 5,
      "PTS": 13
     }
    },
    {
     "participantId": "soccer.alanyaspor",
     "participantType": "team",
     "rank": 10,
     "stats": {
      "GP": 9,
      "W": 3,
      "D": 3,
      "L": 3,
      "GF": 9,
      "GA": 11,
      "GD": -2,
      "PTS": 12
     }
    },
    {
     "participantId": "soccer.istanbul-basaksehir",
     "participantType": "team",
     "rank": 11,
     "stats": {
      "GP": 8,
      "W": 3,
      "D": 2,
      "L": 3,
      "GF": 12,
      "GA": 12,
      "GD": 0,
      "PTS": 11
     }
    },
    {
     "participantId": "soccer.caykur-rizespor",
     "participantType": "team",
     "rank": 12,
     "stats": {
      "GP": 8,
      "W": 3,
      "D": 1,
      "L": 4,
      "GF": 8,
      "GA": 11,
      "GD": -3,
      "PTS": 10
     }
    },
    {
     "participantId": "soccer.goztepe",
     "participantType": "team",
     "rank": 13,
     "stats": {
      "GP": 8,
      "W": 2,
      "D": 3,
      "L": 3,
      "GF": 17,
      "GA": 16,
      "GD": 1,
      "PTS": 9
     }
    },
    {
     "participantId": "soccer.konyaspor",
     "participantType": "team",
     "rank": 14,
     "stats": {
      "GP": 9,
      "W": 2,
      "D": 2,
      "L": 5,
      "GF": 6,
      "GA": 9,
      "GD": -3,
      "PTS": 8
     }
    },
    {
     "participantId": "soccer.gaziantep-fk",
     "participantType": "team",
     "rank": 15,
     "stats": {
      "GP": 9,
      "W": 2,
      "D": 2,
      "L": 5,
      "GF": 9,
      "GA": 15,
      "GD": -6,
      "PTS": 8
     }
    },
    {
     "participantId": "soccer.genclerbirligi",
     "participantType": "team",
     "rank": 16,
     "stats": {
      "GP": 9,
      "W": 2,
      "D": 2,
      "L": 5,
      "GF": 7,
      "GA": 18,
      "GD": -11,
      "PTS": 8
     },
     "extra": {
      "note": {
       "text": "Relegated",
       "color": "#FF7F84"
      }
     }
    },
    {
     "participantId": "soccer.samsunspor",
     "participantType": "team",
     "rank": 17,
     "stats": {
      "GP": 9,
      "W": 1,
      "D": 1,
      "L": 7,
      "GF": 8,
      "GA": 21,
      "GD": -13,
      "PTS": 4
     },
     "extra": {
      "note": {
       "text": "Relegated",
       "color": "#FF7F84"
      }
     }
    },
    {
     "participantId": "soccer.eyupspor",
     "participantType": "team",
     "rank": 18,
     "stats": {
      "GP": 9,
      "W": 1,
      "D": 0,
      "L": 8,
      "GF": 2,
      "GA": 23,
      "GD": -21,
      "PTS": 3
     },
     "extra": {
      "note": {
       "text": "Relegated",
       "color": "#FF7F84"
      }
     }
    }
   ]
  }
 ]
}
