{
 "schemaVersion": 1,
 "type": "standings",
 "id": "baseball.serie-del-caribe:2024-25",
 "updatedAt": "2026-10-03T18:05:53Z",
 "sources": [
  "mlb-statsapi"
 ],
 "competitionId": "baseball.serie-del-caribe",
 "season": "2024-25",
 "groups": [
  {
   "id": "162",
   "name": "Serie del Caribe",
   "rows": [
    {
     "participantId": "baseball.mexico-rojo",
     "participantType": "team",
     "rank": 1,
     "stats": {
      "GP": 6,
      "W": 5,
      "L": 1,
      "PCT": 0.833,
      "STRK": "L1",
      "L10": "5-1",
      "HOME": "3-1",
      "AWAY": "2-0",
      "RS": 22,
      "RA": 6,
      "RD": 16
     },
     "extra": {
      "leagueRank": "1"
     }
    },
    {
     "participantId": "baseball.dominican-republic",
     "participantType": "team",
     "rank": 2,
     "stats": {
      "GP": 6,
      "W": 4,
      "L": 2,
      "PCT": 0.667,
      "STRK": "W2",
      "L10": "4-2",
      "HOME": "1-1",
      "AWAY": "3-1",
      "RS": 27,
      "RA": 17,
      "RD": 10
     },
     "extra": {
      "leagueRank": "2"
     }
    },
    {
     "participantId": "baseball.puerto-rico",
     "participantType": "team",
     "rank": 3,
     "stats": {
      "GP": 6,
      "W": 3,
      "L": 3,
      "PCT": 0.5,
      "STRK": "W1",
      "L10": "3-3",
      "HOME": "1-1",
      "AWAY": "2-2",
      "RS": 27,
      "RA": 34,
      "RD": -7
     },
     "extra": {
      "leagueRank": "3"
     }
    },
    {
     "participantId": "baseball.venezuela",
     "participantType": "team",
     "rank": 4,
     "stats": {
      "GP": 6,
      "W": 2,
      "L": 4,
      "PCT": 0.333,
      "STRK": "L2",
      "L10": "2-4",
      "HOME": "1-3",
      "AWAY": "1-1",
      "RS": 29,
      "RA": 21,
      "RD": 8
     },
     "extra": {
      "leagueRank": "4"
     }
    },
    {
     "participantId": "baseball.japan",
     "participantType": "team",
     "rank": 5,
     "stats": {
      "GP": 4,
      "W": 0,
      "L": 4,
      "PCT": 0.0,
      "STRK": "L4",
      "L10": "0-4",
      "HOME": "0-2",
      "AWAY": "0-2",
      "RS": 5,
      "RA": 32,
      "RD": -27
     },
     "extra": {
      "leagueRank": "5"
     }
    }
   ]
  }
 ]
}
