{
 "schemaVersion": 1,
 "type": "standings",
 "id": "baseball.lpb-colombia:2025-26",
 "updatedAt": "2026-10-03T18:07:05Z",
 "sources": [
  "lpbcol"
 ],
 "competitionId": "baseball.lpb-colombia",
 "season": "2025-26",
 "groups": [
  {
   "id": "all",
   "name": "Temporada regular",
   "rows": [
    {
     "participantId": "baseball.caimanes",
     "participantType": "team",
     "rank": 1,
     "stats": {
      "W": 19,
      "L": 11,
      "T": 0,
      "PCT": 0.633,
      "GB": 0.0
     }
    },
    {
     "participantId": "baseball.tigres",
     "participantType": "team",
     "rank": 2,
     "stats": {
      "W": 16,
      "L": 14,
      "T": 0,
      "PCT": 0.533,
      "GB": 3.0
     }
    },
    {
     "participantId": "baseball.vaqueros",
     "participantType": "team",
     "rank": 3,
     "stats": {
      "W": 16,
      "L": 14,
      "T": 0,
      "PCT": 0.533,
      "GB": 3.0
     }
    },
    {
     "participantId": "baseball.toros",
     "participantType": "team",
     "rank": 4,
     "stats": {
      "W": 9,
      "L": 21,
      "T": 0,
      "PCT": 0.3,
      "GB": 10.0
     }
    }
   ]
  }
 ]
}
