{
 "schemaVersion": 1,
 "type": "standings",
 "id": "baseball.lbprc:2024-25",
 "updatedAt": "2026-10-03T18:05:34Z",
 "sources": [
  "mlb-statsapi"
 ],
 "competitionId": "baseball.lbprc",
 "season": "2024-25",
 "groups": [
  {
   "id": "133",
   "name": "Liga de Béisbol Profesional Roberto Clemente (Puerto Rico)",
   "rows": [
    {
     "participantId": "baseball.indios-de-mayaguez",
     "participantType": "team",
     "rank": 1,
     "stats": {
      "GP": 40,
      "W": 24,
      "L": 16,
      "PCT": 0.6,
      "GB": -5.0,
      "STRK": "W1",
      "L10": "6-4",
      "HOME": "15-5",
      "AWAY": "9-11",
      "RS": 170,
      "RA": 134,
      "RD": 36
     },
     "extra": {
      "leagueRank": "1"
     }
    },
    {
     "participantId": "baseball.cangrejeros-de-santurce",
     "participantType": "team",
     "rank": 2,
     "stats": {
      "GP": 40,
      "W": 21,
      "L": 19,
      "PCT": 0.525,
      "GB": -2.0,
      "STRK": "L1",
      "L10": "6-4",
      "HOME": "12-8",
      "AWAY": "9-11",
      "RS": 158,
      "RA": 121,
      "RD": 37
     },
     "extra": {
      "leagueRank": "2"
     }
    },
    {
     "participantId": "baseball.senadores-de-san-juan",
     "participantType": "team",
     "rank": 3,
     "stats": {
      "GP": 40,
      "W": 21,
      "L": 19,
      "PCT": 0.525,
      "GB": -2.0,
      "STRK": "L1",
      "L10": "4-6",
      "HOME": "11-9",
      "AWAY": "10-10",
      "RS": 142,
      "RA": 163,
      "RD": -21
     },
     "extra": {
      "leagueRank": "3"
     }
    },
    {
     "participantId": "baseball.criollos-de-caguas",
     "participantType": "team",
     "rank": 4,
     "stats": {
      "GP": 40,
      "W": 19,
      "L": 21,
      "PCT": 0.475,
      "STRK": "W1",
      "L10": "6-4",
      "HOME": "8-12",
      "AWAY": "11-9",
      "RS": 158,
      "RA": 137,
      "RD": 21
     },
     "extra": {
      "leagueRank": "4"
     }
    },
    {
     "participantId": "baseball.leones-de-ponce",
     "participantType": "team",
     "rank": 5,
     "stats": {
      "GP": 40,
      "W": 18,
      "L": 22,
      "PCT": 0.45,
      "GB": 1.0,
      "STRK": "W1",
      "L10": "4-6",
      "HOME": "9-11",
      "AWAY": "9-11",
      "RS": 143,
      "RA": 179,
      "RD": -36
     },
     "extra": {
      "leagueRank": "5"
     }
    },
    {
     "participantId": "baseball.gigantes-de-carolina",
     "participantType": "team",
     "rank": 6,
     "stats": {
      "GP": 40,
      "W": 17,
      "L": 23,
      "PCT": 0.425,
      "GB": 2.0,
      "STRK": "L1",
      "L10": "4-6",
      "HOME": "8-12",
      "AWAY": "9-11",
      "RS": 136,
      "RA": 173,
      "RD": -37
     },
     "extra": {
      "leagueRank": "6"
     }
    }
   ]
  }
 ]
}
