{
 "schemaVersion": 1,
 "type": "standings",
 "id": "soccer.mex-1:2026-27",
 "updatedAt": "2026-10-18T04:31:50Z",
 "sources": [
  "espn"
 ],
 "competitionId": "soccer.mex-1",
 "season": "2026-27",
 "groups": [
  {
   "id": "1",
   "name": "2026 Torneo Apertura",
   "rows": [
    {
     "participantId": "soccer.america",
     "participantType": "team",
     "rank": 1,
     "stats": {
      "GP": 11,
      "W": 7,
      "D": 3,
      "L": 1,
      "GF": 27,
      "GA": 14,
      "GD": 13,
      "PTS": 24
     }
    },
    {
     "participantId": "soccer.toluca",
     "participantType": "team",
     "rank": 2,
     "stats": {
      "GP": 12,
      "W": 6,
      "D": 3,
      "L": 3,
      "GF": 26,
      "GA": 16,
      "GD": 10,
      "PTS": 21
     }
    },
    {
     "participantId": "soccer.atlas",
     "participantType": "team",
     "rank": 3,
     "stats": {
      "GP": 12,
      "W": 6,
      "D": 3,
      "L": 3,
      "GF": 19,
      "GA": 18,
      "GD": 1,
      "PTS": 21
     }
    },
    {
     "participantId": "soccer.guadalajara",
     "participantType": "team",
     "rank": 4,
     "stats": {
      "GP": 12,
      "W": 5,
      "D": 5,
      "L": 2,
      "GF": 19,
      "GA": 12,
      "GD": 7,
      "PTS": 20
     }
    },
    {
     "participantId": "soccer.queretaro",
     "participantType": "team",
     "rank": 5,
     "stats": {
      "GP": 11,
      "W": 6,
      "D": 2,
      "L": 3,
      "GF": 15,
      "GA": 13,
      "GD": 2,
      "PTS": 20
     }
    },
    {
     "participantId": "soccer.leon",
     "participantType": "team",
     "rank": 6,
     "stats": {
      "GP": 12,
      "W": 5,
      "D": 3,
      "L": 4,
      "GF": 18,
      "GA": 17,
      "GD": 1,
      "PTS": 18
     }
    },
    {
     "participantId": "soccer.cruz-azul",
     "participantType": "team",
     "rank": 7,
     "stats": {
      "GP": 11,
      "W": 5,
      "D": 2,
      "L": 4,
      "GF": 22,
      "GA": 21,
      "GD": 1,
      "PTS": 17
     }
    },
    {
     "participantId": "soccer.santos",
     "participantType": "team",
     "rank": 8,
     "stats": {
      "GP": 12,
      "W": 5,
      "D": 1,
      "L": 6,
      "GF": 17,
      "GA": 16,
      "GD": 1,
      "PTS": 16
     }
    },
    {
     "participantId": "soccer.tijuana",
     "participantType": "team",
     "rank": 9,
     "stats": {
      "GP": 11,
      "W": 4,
      "D": 4,
      "L": 3,
      "GF": 15,
      "GA": 14,
      "GD": 1,
      "PTS": 16
     }
    },
    {
     "participantId": "soccer.pumas-unam",
     "participantType": "team",
     "rank": 10,
     "stats": {
      "GP": 12,
      "W": 4,
      "D": 4,
      "L": 4,
      "GF": 19,
      "GA": 20,
      "GD": -1,
      "PTS": 16
     }
    },
    {
     "participantId": "soccer.puebla",
     "participantType": "team",
     "rank": 11,
     "stats": {
      "GP": 12,
      "W": 4,
      "D": 4,
      "L": 4,
      "GF": 12,
      "GA": 13,
      "GD": -1,
      "PTS": 16
     }
    },
    {
     "participantId": "soccer.monterrey",
     "participantType": "team",
     "rank": 12,
     "stats": {
      "GP": 10,
      "W": 4,
      "D": 2,
      "L": 4,
      "GF": 17,
      "GA": 15,
      "GD": 2,
      "PTS": 14
     }
    },
    {
     "participantId": "soccer.tigres-uanl",
     "participantType": "team",
     "rank": 13,
     "stats": {
      "GP": 12,
      "W": 3,
      "D": 5,
      "L": 4,
      "GF": 14,
      "GA": 16,
      "GD": -2,
      "PTS": 14
     }
    },
    {
     "participantId": "soccer.pachuca",
     "participantType": "team",
     "rank": 14,
     "stats": {
      "GP": 11,
      "W": 3,
      "D": 4,
      "L": 4,
      "GF": 18,
      "GA": 14,
      "GD": 4,
      "PTS": 13
     }
    },
    {
     "participantId": "soccer.atletico-de-san-luis",
     "participantType": "team",
     "rank": 15,
     "stats": {
      "GP": 12,
      "W": 3,
      "D": 4,
      "L": 5,
      "GF": 16,
      "GA": 21,
      "GD": -5,
      "PTS": 13
     }
    },
    {
     "participantId": "soccer.atlante",
     "participantType": "team",
     "rank": 16,
     "stats": {
      "GP": 12,
      "W": 2,
      "D": 5,
      "L": 5,
      "GF": 13,
      "GA": 19,
      "GD": -6,
      "PTS": 11
     }
    },
    {
     "participantId": "soccer.necaxa",
     "participantType": "team",
     "rank": 17,
     "stats": {
      "GP": 12,
      "W": 2,
      "D": 3,
      "L": 7,
      "GF": 15,
      "GA": 25,
      "GD": -10,
      "PTS": 9
     }
    },
    {
     "participantId": "soccer.fc-juarez",
     "participantType": "team",
     "rank": 18,
     "stats": {
      "GP": 11,
      "W": 1,
      "D": 1,
      "L": 9,
      "GF": 8,
      "GA": 26,
      "GD": -18,
      "PTS": 4
     }
    }
   ]
  }
 ]
}
