{
 "schemaVersion": 1,
 "type": "standings",
 "id": "baseball.lmb:2022",
 "updatedAt": "2026-10-03T18:06:46Z",
 "sources": [
  "mlb-statsapi"
 ],
 "competitionId": "baseball.lmb",
 "season": "2022",
 "groups": [
  {
   "id": "222",
   "name": "Mexican League Norte",
   "rows": [
    {
     "participantId": "baseball.toros-de-tijuana",
     "participantType": "team",
     "rank": 1,
     "stats": {
      "GP": 90,
      "W": 62,
      "L": 28,
      "PCT": 0.689,
      "GB": -19.0,
      "STRK": "W2",
      "L10": "7-3",
      "HOME": "31-14",
      "AWAY": "31-14",
      "RS": 624,
      "RA": 384,
      "RD": 240
     },
     "extra": {
      "leagueRank": "1"
     }
    },
    {
     "participantId": "baseball.tecos-de-los-dos-laredos",
     "participantType": "team",
     "rank": 2,
     "stats": {
      "GP": 86,
      "W": 59,
      "L": 27,
      "PCT": 0.686,
      "GB": -18.0,
      "STRK": "W2",
      "L10": "9-1",
      "HOME": "35-10",
      "AWAY": "24-17",
      "RS": 460,
      "RA": 349,
      "RD": 111
     },
     "extra": {
      "leagueRank": "2"
     }
    },
    {
     "participantId": "baseball.acereros-del-norte",
     "participantType": "team",
     "rank": 3,
     "stats": {
      "GP": 85,
      "W": 54,
      "L": 31,
      "PCT": 0.635,
      "GB": -13.5,
      "STRK": "W9",
      "L10": "9-1",
      "HOME": "30-15",
      "AWAY": "24-16",
      "RS": 622,
      "RA": 448,
      "RD": 174
     },
     "extra": {
      "leagueRank": "3"
     }
    },
    {
     "participantId": "baseball.sultanes-de-monterrey-2",
     "participantType": "team",
     "rank": 4,
     "stats": {
      "GP": 90,
      "W": 51,
      "L": 39,
      "PCT": 0.567,
      "GB": -8.0,
      "STRK": "L1",
      "L10": "4-6",
      "HOME": "28-17",
      "AWAY": "23-22",
      "RS": 523,
      "RA": 482,
      "RD": 41
     },
     "extra": {
      "leagueRank": "5"
     }
    },
    {
     "participantId": "baseball.algodoneros-union-laguna",
     "participantType": "team",
     "rank": 5,
     "stats": {
      "GP": 88,
      "W": 48,
      "L": 40,
      "PCT": 0.545,
      "GB": -6.0,
      "STRK": "L2",
      "L10": "6-4",
      "HOME": "21-22",
      "AWAY": "27-18",
      "RS": 535,
      "RA": 504,
      "RD": 31
     },
     "extra": {
      "leagueRank": "8"
     }
    },
    {
     "participantId": "baseball.rieleros-de-aguascalientes",
     "participantType": "team",
     "rank": 6,
     "stats": {
      "GP": 88,
      "W": 42,
      "L": 46,
      "PCT": 0.477,
      "STRK": "L2",
      "L10": "3-7",
      "HOME": "20-25",
      "AWAY": "22-21",
      "RS": 562,
      "RA": 546,
      "RD": 16
     },
     "extra": {
      "leagueRank": "11"
     }
    },
    {
     "participantId": "baseball.saraperos-de-saltillo",
     "participantType": "team",
     "rank": 7,
     "stats": {
      "GP": 90,
      "W": 38,
      "L": 52,
      "PCT": 0.422,
      "GB": 5.0,
      "STRK": "L9",
      "L10": "1-9",
      "HOME": "24-21",
      "AWAY": "14-31",
      "RS": 629,
      "RA": 688,
      "RD": -59
     },
     "extra": {
      "leagueRank": "13"
     }
    },
    {
     "participantId": "baseball.caliente-de-durango",
     "participantType": "team",
     "rank": 8,
     "stats": {
      "GP": 90,
      "W": 37,
      "L": 53,
      "PCT": 0.411,
      "GB": 6.0,
      "STRK": "W1",
      "L10": "4-6",
      "HOME": "23-22",
      "AWAY": "14-31",
      "RS": 612,
      "RA": 677,
      "RD": -65
     },
     "extra": {
      "leagueRank": "14"
     }
    },
    {
     "participantId": "baseball.mariachis-de-guadalajara",
     "participantType": "team",
     "rank": 9,
     "stats": {
      "GP": 90,
      "W": 33,
      "L": 57,
      "PCT": 0.367,
      "GB": 10.0,
      "STRK": "W1",
      "L10": "2-8",
      "HOME": "19-26",
      "AWAY": "14-31",
      "RS": 573,
      "RA": 661,
      "RD": -88
     },
     "extra": {
      "leagueRank": "16"
     }
    }
   ]
  },
  {
   "id": "223",
   "name": "Mexican League Sur",
   "rows": [
    {
     "participantId": "baseball.diablos-rojos-del-mexico",
     "participantType": "team",
     "rank": 1,
     "stats": {
      "GP": 84,
      "W": 50,
      "L": 34,
      "PCT": 0.595,
      "GB": -11.5,
      "STRK": "W6",
      "L10": "9-1",
      "HOME": "29-12",
      "AWAY": "21-22",
      "RS": 614,
      "RA": 530,
      "RD": 84
     },
     "extra": {
      "leagueRank": "4"
     }
    },
    {
     "participantId": "baseball.olmecas-de-tabasco",
     "participantType": "team",
     "rank": 2,
     "stats": {
      "GP": 84,
      "W": 47,
      "L": 37,
      "PCT": 0.56,
      "GB": -8.5,
      "STRK": "W6",
      "L10": "6-4",
      "HOME": "25-14",
      "AWAY": "22-23",
      "RS": 437,
      "RA": 397,
      "RD": 40
     },
     "extra": {
      "leagueRank": "6"
     }
    },
    {
     "participantId": "baseball.pericos-de-puebla",
     "participantType": "team",
     "rank": 3,
     "stats": {
      "GP": 87,
      "W": 48,
      "L": 39,
      "PCT": 0.552,
      "GB": -8.0,
      "STRK": "L3",
      "L10": "7-3",
      "HOME": "26-16",
      "AWAY": "22-23",
      "RS": 546,
      "RA": 483,
      "RD": 63
     },
     "extra": {
      "leagueRank": "7"
     }
    },
    {
     "participantId": "baseball.leones-de-yucatan",
     "participantType": "team",
     "rank": 4,
     "stats": {
      "GP": 89,
      "W": 46,
      "L": 43,
      "PCT": 0.517,
      "GB": -5.0,
      "STRK": "W5",
      "L10": "7-3",
      "HOME": "26-19",
      "AWAY": "20-24",
      "RS": 495,
      "RA": 457,
      "RD": 38
     },
     "extra": {
      "leagueRank": "9"
     }
    },
    {
     "participantId": "baseball.tigres-de-quintana-roo",
     "participantType": "team",
     "rank": 5,
     "stats": {
      "GP": 90,
      "W": 44,
      "L": 46,
      "PCT": 0.489,
      "GB": -2.5,
      "STRK": "W2",
      "L10": "3-7",
      "HOME": "22-23",
      "AWAY": "22-23",
      "RS": 474,
      "RA": 556,
      "RD": -82
     },
     "extra": {
      "leagueRank": "10"
     }
    },
    {
     "participantId": "baseball.el-aguila-de-veracruz",
     "participantType": "team",
     "rank": 6,
     "stats": {
      "GP": 89,
      "W": 41,
      "L": 48,
      "PCT": 0.461,
      "STRK": "L2",
      "L10": "4-6",
      "HOME": "23-22",
      "AWAY": "18-26",
      "RS": 433,
      "RA": 481,
      "RD": -48
     },
     "extra": {
      "leagueRank": "12"
     }
    },
    {
     "participantId": "baseball.guerreros-de-oaxaca",
     "participantType": "team",
     "rank": 7,
     "stats": {
      "GP": 87,
      "W": 34,
      "L": 53,
      "PCT": 0.391,
      "GB": 6.0,
      "STRK": "L4",
      "L10": "3-7",
      "HOME": "23-22",
      "AWAY": "11-31",
      "RS": 533,
      "RA": 606,
      "RD": -73
     },
     "extra": {
      "leagueRank": "15"
     }
    },
    {
     "participantId": "baseball.piratas-de-campeche",
     "participantType": "team",
     "rank": 8,
     "stats": {
      "GP": 87,
      "W": 29,
      "L": 58,
      "PCT": 0.333,
      "GB": 11.0,
      "STRK": "L7",
      "L10": "1-9",
      "HOME": "14-28",
      "AWAY": "15-30",
      "RS": 414,
      "RA": 583,
      "RD": -169
     },
     "extra": {
      "leagueRank": "17"
     }
    },
    {
     "participantId": "baseball.bravos-de-leon",
     "participantType": "team",
     "rank": 9,
     "stats": {
      "GP": 90,
      "W": 29,
      "L": 61,
      "PCT": 0.322,
      "GB": 12.5,
      "STRK": "L1",
      "L10": "3-7",
      "HOME": "18-27",
      "AWAY": "11-34",
      "RS": 512,
      "RA": 766,
      "RD": -254
     },
     "extra": {
      "leagueRank": "18"
     }
    }
   ]
  }
 ]
}
